ModID,ModName,Memail,Password,ModeratorLevel,Status,Mdesc,ProfilePic
1,Tamqrah Goodband,tgoodband0@4shared.com,vM4mgUpZt,fermentum justo,eros suspendisse accumsan,"Duis at velit eu est congue elementum. In hac habitasse platea dictumst. Morbi vestibulum, velit id pretium iaculis, diam erat fermentum justo, nec condimentum neque sapien placerat ante.",SemPraesent.mp3
2,Benedetta Gisburn,bgisburn1@myspace.com,"hF8w=.c1z4>|*FB,",ante,justo,In congue. Etiam justo. Etiam pretium iaculis justo.,CuraeDonec.avi
3,Marney Setter,msetter2@nationalgeographic.com,xH184Ba<,in hac,rutrum ac,"Nulla neque libero, convallis eget, eleifend luctus, ultricies eu, nibh.",PortaVolutpatQuam.doc
4,Casar Willment,cwillment3@theguardian.com,"aB4/D{,t2F",a suscipit,est congue,Vestibulum ante ipsum primis in faucibus orci luctus et ultrices posuere cubilia Curae; Duis faucibus accumsan odio. Curabitur convallis.,PellentesqueViverra.avi
5,Wilie Tanzer,wtanzer4@imdb.com,yD1gzx*I)tr,euismod scelerisque,cubilia curae duis,Ut at dolor quis odio consequat varius. Integer ac leo.,Justo.doc
6,Lynne Castro,lcastro5@yahoo.co.jp,hK4LcC3`s6MbQR=q,nec nisi,ornare,Aliquam non mauris. Morbi non lectus.,DuiProin.mp3
7,Lindie Reffe,lreffe6@newsvine.com,bM4qGCBv,odio odio,semper interdum mauris,"Praesent blandit. Nam nulla. Integer pede justo, lacinia eget, tincidunt eget, tempus vel, pede.",Eget.avi
8,Paddy Sellan,psellan7@wordpress.com,wG2A0Lmq,platea dictumst,dis parturient,Integer tincidunt ante vel ipsum.,Orci.mp3
9,Marji Urlich,murlich8@issuu.com,"dD1/)""?(fx",sapien,imperdiet,Sed ante. Vivamus tortor. Duis mattis egestas metus.,CommodoVulputateJusto.gif
10,Giacobo Vivien,gvivien9@bloglovin.com,oA4&|jSX2\,integer aliquet,sagittis,"Quisque porta volutpat erat. Quisque erat eros, viverra eget, congue eget, semper rutrum, nulla.",Curae.ppt
